{
  "authority": "CONTEXT_RECONSTRUCTION_ONLY",
  "blocked": [],
  "cipi_ref": {
    "branch": "main",
    "commit_sha": "67beb7b287618e7d01e87d241e2037fd464e5416",
    "freshness_basis": "source_state_digest"
  },
  "conflicts": [],
  "freshness": "FRESH",
  "generated_at": "2026-09-29T20:58:30+09:00",
  "generation_id": "e0d3c3e0ec9fd4031d6ec503",
  "human_gates": [],
  "latest_decision_refs": [],
  "phase": "IDLE",
  "product_ref": {
    "commit_sha": "4b8c765b09cbf28ed28cd61442cfd87a5a8ad35b",
    "ref": "main",
    "repository": "techitechi0331-svg/vocal_rider",
    "verification": "VERIFIED"
  },
  "project_id": "vocal_rider",
  "ready": [],
  "rejected_refs": [],
  "research": {
    "decision_ref_count": 0,
    "review_ref_count": 0,
    "track_lifecycle": {}
  },
  "resume_contract": {
    "blocked_dependencies": [],
    "can_autonomously_resume": false,
    "can_resume": true,
    "human_gates": [],
    "must_not_repeat": [],
    "recommended_action": "NO_READY_WORK",
    "required_context": [],
    "resume_mode": "IDLE"
  },
  "review_refs": [],
  "schema_version": "1.0",
  "source_manifest": [
    {
      "path": "automation/cross_repo/registry.yaml",
      "repository": "techitechi0331-svg/cipi",
      "sha256": "5c999470de2f2818a6b83b2ca841b8166837b79e1d40762e2d21d559d4ef5753",
      "source_type": "CROSS_REPO_REGISTRY"
    },
    {
      "kind": "directory_index",
      "path": "research/decisions",
      "repository": "techitechi0331-svg/cipi",
      "sha256": "64500f3233d81f993194232d0bd82e175dae8a67045f6d6e379daabbb4d68350",
      "source_type": "CIPI_DIRECTORY_INDEX"
    },
    {
      "path": "research/health/automation-status.json",
      "repository": "techitechi0331-svg/cipi",
      "sha256": "ea3222df95b9a19d04f2d7ee76b855818ffceb75e49beb529e7e81aca79c4210",
      "source_type": "AUTOMATION_HEALTH"
    },
    {
      "path": "research/health/autonomous-bridge.json",
      "repository": "techitechi0331-svg/cipi",
      "sha256": "4e6eb09f216d626f4fa4bb51afd9440b56b6b8c37abacdaff142d8eebc094514",
      "source_type": "AUTONOMOUS_BRIDGE_HEALTH"
    },
    {
      "kind": "directory_index",
      "path": "research/jobs/completed",
      "repository": "techitechi0331-svg/cipi",
      "sha256": "048614abbfe3daa11d3548e14cc5328a795c7df4805cfb2d6497137a3fcac08b",
      "source_type": "CIPI_DIRECTORY_INDEX"
    },
    {
      "kind": "directory_index",
      "path": "research/jobs/queued",
      "repository": "techitechi0331-svg/cipi",
      "sha256": "591cd30898f22c0cb226758a5f75908427a9fa25d1d2f385306db35237384651",
      "source_type": "CIPI_DIRECTORY_INDEX"
    },
    {
      "kind": "directory_index",
      "path": "research/reviews",
      "repository": "techitechi0331-svg/cipi",
      "sha256": "6738b5ae6d6108fa861ea86cec4496bdc186b99027780dae8ddda354ea561641",
      "source_type": "CIPI_DIRECTORY_INDEX"
    }
  ],
  "source_state_digest": "e5674da7949c0d366b4fed4b27e71ca321cfddf6cd4737c76ea8e27092959871",
  "unresolved_questions": [],
  "work": {
    "blocked_count": 0,
    "human_gate_count": 0,
    "queued_job_count": 0,
    "ready_count": 0
  }
}
