{
  "authority": "CONTEXT_RECONSTRUCTION_ONLY",
  "blocked": [],
  "cipi_ref": {
    "branch": "main",
    "commit_sha": "79fbf39ab2a1bc7b368948f3ed8cfb0418b25c28",
    "freshness_basis": "source_state_digest"
  },
  "conflicts": [],
  "freshness": "FRESH",
  "generated_at": "2026-09-29T13:15:08+09:00",
  "generation_id": "8861788175bca9db0df23b47",
  "human_gates": [],
  "latest_decision_refs": [],
  "phase": "IDLE",
  "product_ref": {
    "commit_sha": "ac3620a0ccfca6b4646e81828e7863dd8a76fc54",
    "ref": "main",
    "repository": "techitechi0331-svg/610",
    "verification": "VERIFIED"
  },
  "project_id": "pre610",
  "ready": [],
  "rejected_refs": [],
  "research": {
    "decision_ref_count": 0,
    "review_ref_count": 0,
    "track_lifecycle": {}
  },
  "resume_contract": {
    "blocked_dependencies": [],
    "can_autonomously_resume": false,
    "can_resume": true,
    "human_gates": [],
    "must_not_repeat": [],
    "recommended_action": "NO_READY_WORK",
    "required_context": [],
    "resume_mode": "IDLE"
  },
  "review_refs": [],
  "schema_version": "1.0",
  "source_manifest": [
    {
      "path": "automation/cross_repo/registry.yaml",
      "repository": "techitechi0331-svg/cipi",
      "sha256": "f9703b679422a22a2d1693d492b436c837358ae3a83a24203134bc05ae20f8aa",
      "source_type": "CROSS_REPO_REGISTRY"
    },
    {
      "kind": "directory_index",
      "path": "research/decisions",
      "repository": "techitechi0331-svg/cipi",
      "sha256": "c66ca453e5be3cbe4942fd2ffb73c9398d2c518acc95f32f83810a842e444a6d",
      "source_type": "CIPI_DIRECTORY_INDEX"
    },
    {
      "path": "research/health/automation-status.json",
      "repository": "techitechi0331-svg/cipi",
      "sha256": "628e9e9221e6eee000ae31a5c61f616230501ea57c9dbf29449789a389315dc8",
      "source_type": "AUTOMATION_HEALTH"
    },
    {
      "path": "research/health/autonomous-bridge.json",
      "repository": "techitechi0331-svg/cipi",
      "sha256": "4e6eb09f216d626f4fa4bb51afd9440b56b6b8c37abacdaff142d8eebc094514",
      "source_type": "AUTONOMOUS_BRIDGE_HEALTH"
    },
    {
      "kind": "directory_index",
      "path": "research/jobs/completed",
      "repository": "techitechi0331-svg/cipi",
      "sha256": "ee970ab35df5491d37cd99a62c5e4ba72ffb4d5221fb35c9b5bc24d9ce0b098d",
      "source_type": "CIPI_DIRECTORY_INDEX"
    },
    {
      "kind": "directory_index",
      "path": "research/jobs/queued",
      "repository": "techitechi0331-svg/cipi",
      "sha256": "fece5956522fe0fa223a3f5dbe1b6f8944a02464ce05c7bc5a66133bfb266a95",
      "source_type": "CIPI_DIRECTORY_INDEX"
    },
    {
      "kind": "directory_index",
      "path": "research/reviews",
      "repository": "techitechi0331-svg/cipi",
      "sha256": "4457638e9e833af714c8dedaf1a3abb8d5044d2c790371a62fc3ba3cc51bd1ea",
      "source_type": "CIPI_DIRECTORY_INDEX"
    }
  ],
  "source_state_digest": "fb4e15ebe935241d4cbf66b67e4a28cc783ea86335f50d9d132bb797b73d109b",
  "unresolved_questions": [],
  "work": {
    "blocked_count": 0,
    "human_gate_count": 0,
    "queued_job_count": 0,
    "ready_count": 0
  }
}
