{
  "authority": "CONTEXT_RECONSTRUCTION_ONLY",
  "blocked": [],
  "cipi_ref": {
    "branch": "main",
    "commit_sha": "b7b5629cd703d83b603fd5bb0373be5526250ea8",
    "freshness_basis": "source_state_digest"
  },
  "conflicts": [],
  "freshness": "FRESH",
  "generated_at": "2026-09-29T21:19:23+09:00",
  "generation_id": "395580cabd3f74ad179fcd92",
  "human_gates": [],
  "latest_decision_refs": [],
  "phase": "IDLE",
  "product_ref": {
    "commit_sha": "c139c0526157a40e3ba815ff5616311d8c34eaa6",
    "ref": "main",
    "repository": "techitechi0331-svg/amp_simulator",
    "verification": "VERIFIED"
  },
  "project_id": "amp_simulator",
  "ready": [],
  "rejected_refs": [],
  "research": {
    "decision_ref_count": 0,
    "review_ref_count": 0,
    "track_lifecycle": {}
  },
  "resume_contract": {
    "blocked_dependencies": [],
    "can_autonomously_resume": false,
    "can_resume": true,
    "human_gates": [],
    "must_not_repeat": [],
    "recommended_action": "NO_READY_WORK",
    "required_context": [],
    "resume_mode": "IDLE"
  },
  "review_refs": [],
  "schema_version": "1.0",
  "source_manifest": [
    {
      "path": "automation/cross_repo/registry.yaml",
      "repository": "techitechi0331-svg/cipi",
      "sha256": "cfab4853d2aac36a8885e93a24e4ca7047746fd5e191954c63cb227e49093c53",
      "source_type": "CROSS_REPO_REGISTRY"
    },
    {
      "kind": "directory_index",
      "path": "research/decisions",
      "repository": "techitechi0331-svg/cipi",
      "sha256": "2f617e57385b68ae1b816c88b0c73874ad5bb0a4d4a39c80c78a0ccc5bdc8f59",
      "source_type": "CIPI_DIRECTORY_INDEX"
    },
    {
      "path": "research/health/automation-status.json",
      "repository": "techitechi0331-svg/cipi",
      "sha256": "18918524b44dd659148b8011353b1e91b3c8df6b3629af7345c1df4b4839d6ef",
      "source_type": "AUTOMATION_HEALTH"
    },
    {
      "path": "research/health/autonomous-bridge.json",
      "repository": "techitechi0331-svg/cipi",
      "sha256": "536268b61e85c6c79d01f7dd68b948e26646030e3a55e8f0fec02e5548deb982",
      "source_type": "AUTONOMOUS_BRIDGE_HEALTH"
    },
    {
      "kind": "directory_index",
      "path": "research/jobs/completed",
      "repository": "techitechi0331-svg/cipi",
      "sha256": "31c120fca8fb89d7ff9c6d726eddfa3ea8d80b74a0654b006b0929bbfda252f5",
      "source_type": "CIPI_DIRECTORY_INDEX"
    },
    {
      "kind": "directory_index",
      "path": "research/jobs/queued",
      "repository": "techitechi0331-svg/cipi",
      "sha256": "b54b309c433057f67870fe95920acfaeb0724511b6d1cbb92a97a57acaf7c14a",
      "source_type": "CIPI_DIRECTORY_INDEX"
    },
    {
      "kind": "directory_index",
      "path": "research/reviews",
      "repository": "techitechi0331-svg/cipi",
      "sha256": "a4cb70e1e33b585be56dee49611975b0fa373d5c9199d8f005396c38c4be648e",
      "source_type": "CIPI_DIRECTORY_INDEX"
    }
  ],
  "source_state_digest": "ef8079f5e590ed25cdfba3fcae5f1da1cf3ee76f1ad0177b73886150b9179d1c",
  "unresolved_questions": [],
  "work": {
    "blocked_count": 0,
    "human_gate_count": 0,
    "queued_job_count": 0,
    "ready_count": 0
  }
}
