{
  "authority": "CONTEXT_RECONSTRUCTION_ONLY",
  "blocked": [],
  "cipi_ref": {
    "branch": "main",
    "commit_sha": "099dfaea3f1083bdc87bfd09e527f406256be6cf",
    "freshness_basis": "source_state_digest"
  },
  "conflicts": [],
  "freshness": "FRESH",
  "generated_at": "2026-09-29T07:00:20+09:00",
  "generation_id": "4c8800680be0991eccb88e7b",
  "human_gates": [],
  "latest_decision_refs": [],
  "phase": "IDLE",
  "product_ref": {
    "commit_sha": "0afbaaf527cafc15c7d7a94c8a74043efe455565",
    "ref": "main",
    "repository": "techitechi0331-svg/MasterBusComp",
    "verification": "VERIFIED"
  },
  "project_id": "master_bus",
  "ready": [],
  "rejected_refs": [],
  "research": {
    "decision_ref_count": 0,
    "review_ref_count": 0,
    "track_lifecycle": {}
  },
  "resume_contract": {
    "blocked_dependencies": [],
    "can_autonomously_resume": false,
    "can_resume": true,
    "human_gates": [],
    "must_not_repeat": [],
    "recommended_action": "NO_READY_WORK",
    "required_context": [],
    "resume_mode": "IDLE"
  },
  "review_refs": [],
  "schema_version": "1.0",
  "source_manifest": [
    {
      "path": "automation/cross_repo/registry.yaml",
      "repository": "techitechi0331-svg/cipi",
      "sha256": "16dcf5716c87275af30d35893ca50597ae6598ed29bef533dafc3e9f1a4cb6c4",
      "source_type": "CROSS_REPO_REGISTRY"
    },
    {
      "kind": "directory_index",
      "path": "research/decisions",
      "repository": "techitechi0331-svg/cipi",
      "sha256": "c66ca453e5be3cbe4942fd2ffb73c9398d2c518acc95f32f83810a842e444a6d",
      "source_type": "CIPI_DIRECTORY_INDEX"
    },
    {
      "path": "research/health/automation-status.json",
      "repository": "techitechi0331-svg/cipi",
      "sha256": "5d8d05fb5104f199e3b58f589ed05b70155dee4932c08e4c0be8aed97be52394",
      "source_type": "AUTOMATION_HEALTH"
    },
    {
      "path": "research/health/autonomous-bridge.json",
      "repository": "techitechi0331-svg/cipi",
      "sha256": "273a2ea024bb7942a68e6891ed5ea8b058d034e1cea68090844a68019a959f09",
      "source_type": "AUTONOMOUS_BRIDGE_HEALTH"
    },
    {
      "kind": "directory_index",
      "path": "research/jobs/completed",
      "repository": "techitechi0331-svg/cipi",
      "sha256": "ee970ab35df5491d37cd99a62c5e4ba72ffb4d5221fb35c9b5bc24d9ce0b098d",
      "source_type": "CIPI_DIRECTORY_INDEX"
    },
    {
      "kind": "directory_index",
      "path": "research/jobs/queued",
      "repository": "techitechi0331-svg/cipi",
      "sha256": "b54b309c433057f67870fe95920acfaeb0724511b6d1cbb92a97a57acaf7c14a",
      "source_type": "CIPI_DIRECTORY_INDEX"
    },
    {
      "kind": "directory_index",
      "path": "research/reviews",
      "repository": "techitechi0331-svg/cipi",
      "sha256": "4457638e9e833af714c8dedaf1a3abb8d5044d2c790371a62fc3ba3cc51bd1ea",
      "source_type": "CIPI_DIRECTORY_INDEX"
    }
  ],
  "source_state_digest": "6688ffa0efc49286f9cf5618fea8cf2ad50df0c1a91f2511188db02d4d881a9a",
  "unresolved_questions": [],
  "work": {
    "blocked_count": 0,
    "human_gate_count": 0,
    "queued_job_count": 0,
    "ready_count": 0
  }
}
