{
  "authority": "CONTEXT_RECONSTRUCTION_ONLY",
  "blocked": [
    {
      "classification": "BLOCKED_DEPENDENCY",
      "current_human_gates": [
        "FINAL_MIC_INTEGRATION_ADOPTION",
        "REAL_AUDIO_AB"
      ],
      "declared_human_gates": [
        "FINAL_MIC_INTEGRATION_ADOPTION",
        "REAL_AUDIO_AB"
      ],
      "depends_on_jobs": [
        "VIRTUAL-GUITAR-CABINET-SPEAKER-OUTPUT-CONVERGENCE-GATE-001",
        "MIC-SIMULATOR-VERSIONED-CONTRACT-GATE-001",
        "MIC-SIMULATOR-MINIMUM-VALIDATION-GATE-001",
        "MIC-SIMULATOR-CIPI-INTEGRATION-CANDIDATE-GATE-001"
      ],
      "job_id": "VIRTUAL-GUITAR-MIC-INTEGRATION-001",
      "path": "research/jobs/queued/VIRTUAL-GUITAR-MIC-INTEGRATION-001.yaml",
      "priority": 35,
      "research_question": "After the Cabinet/Speaker output boundary and the independent Mic Simulator contract, validation, and CIPI Integration Candidate have converged, can Virtual Guitar integrate the external Mic Engine through a versioned optional boundary without coupling to its internals or regressing existing guitar behavior?",
      "resolved_human_gates": [],
      "state": "QUEUED",
      "unresolved_dependencies": [
        "VIRTUAL-GUITAR-CABINET-SPEAKER-OUTPUT-CONVERGENCE-GATE-001",
        "MIC-SIMULATOR-VERSIONED-CONTRACT-GATE-001",
        "MIC-SIMULATOR-MINIMUM-VALIDATION-GATE-001",
        "MIC-SIMULATOR-CIPI-INTEGRATION-CANDIDATE-GATE-001"
      ],
      "unresolved_human_gates": [
        "FINAL_MIC_INTEGRATION_ADOPTION",
        "REAL_AUDIO_AB"
      ]
    }
  ],
  "cipi_ref": {
    "branch": "main",
    "commit_sha": "b7b5629cd703d83b603fd5bb0373be5526250ea8",
    "freshness_basis": "source_state_digest"
  },
  "conflicts": [],
  "freshness": "FRESH",
  "generated_at": "2026-09-29T21:19:23+09:00",
  "generation_id": "2423251422c35659398a2107",
  "human_gates": [
    {
      "blocking": false,
      "gates": [
        "FINAL_MIC_INTEGRATION_ADOPTION",
        "REAL_AUDIO_AB"
      ],
      "job_id": "VIRTUAL-GUITAR-MIC-INTEGRATION-001",
      "source": "RESEARCH_JOB"
    }
  ],
  "latest_decision_refs": [
    {
      "authority": "ASSISTANT_REVIEW",
      "created_at": "2026-09-26",
      "decision": "REJECT",
      "decision_id": "VOPRIPRO-BALLISTICS-TRANSFER-001:assistant-review-20260926",
      "event_type": "REVIEW",
      "job_id": "VOPRIPRO-BALLISTICS-TRANSFER-001",
      "path": "research/decisions/VOPRIPRO-BALLISTICS-TRANSFER-001/assistant-review-20260926.yaml",
      "review_status": "CONFIRMED"
    }
  ],
  "phase": "BLOCKED",
  "product_ref": {
    "commit_sha": "b7b5629cd703d83b603fd5bb0373be5526250ea8",
    "ref": "main",
    "repository": "techitechi0331-svg/cipi",
    "verification": "VERIFIED"
  },
  "project_id": "cipi",
  "ready": [],
  "rejected_refs": [
    {
      "authority": "ASSISTANT_REVIEW",
      "created_at": "2026-09-26",
      "decision": "REJECT",
      "decision_id": "VOPRIPRO-BALLISTICS-TRANSFER-001:assistant-review-20260926",
      "event_type": "REVIEW",
      "job_id": "VOPRIPRO-BALLISTICS-TRANSFER-001",
      "path": "research/decisions/VOPRIPRO-BALLISTICS-TRANSFER-001/assistant-review-20260926.yaml",
      "review_status": "CONFIRMED"
    }
  ],
  "research": {
    "decision_ref_count": 1,
    "review_ref_count": 0,
    "track_lifecycle": {}
  },
  "resume_contract": {
    "blocked_dependencies": [
      "MIC-SIMULATOR-CIPI-INTEGRATION-CANDIDATE-GATE-001",
      "MIC-SIMULATOR-MINIMUM-VALIDATION-GATE-001",
      "MIC-SIMULATOR-VERSIONED-CONTRACT-GATE-001",
      "VIRTUAL-GUITAR-CABINET-SPEAKER-OUTPUT-CONVERGENCE-GATE-001"
    ],
    "can_autonomously_resume": false,
    "can_resume": true,
    "human_gates": [
      "VIRTUAL-GUITAR-MIC-INTEGRATION-001"
    ],
    "must_not_repeat": [
      "VOPRIPRO-BALLISTICS-TRANSFER-001"
    ],
    "recommended_action": "WAIT_OR_STEAL_OTHER_PROJECT",
    "required_context": [
      "research/decisions/VOPRIPRO-BALLISTICS-TRANSFER-001/assistant-review-20260926.yaml"
    ],
    "resume_mode": "BLOCKED"
  },
  "review_refs": [],
  "schema_version": "1.0",
  "source_manifest": [
    {
      "path": "automation/cross_repo/registry.yaml",
      "repository": "techitechi0331-svg/cipi",
      "sha256": "cfab4853d2aac36a8885e93a24e4ca7047746fd5e191954c63cb227e49093c53",
      "source_type": "CROSS_REPO_REGISTRY"
    },
    {
      "kind": "directory_index",
      "path": "research/decisions",
      "repository": "techitechi0331-svg/cipi",
      "sha256": "2f617e57385b68ae1b816c88b0c73874ad5bb0a4d4a39c80c78a0ccc5bdc8f59",
      "source_type": "CIPI_DIRECTORY_INDEX"
    },
    {
      "path": "research/decisions/VOPRIPRO-BALLISTICS-TRANSFER-001/assistant-review-20260926.yaml",
      "repository": "techitechi0331-svg/cipi",
      "sha256": "099f6eff3c2116013258ad1c027b2a0815fa035649b092e708e8028df46c74df",
      "source_type": "DECISION"
    },
    {
      "path": "research/health/automation-status.json",
      "repository": "techitechi0331-svg/cipi",
      "sha256": "18918524b44dd659148b8011353b1e91b3c8df6b3629af7345c1df4b4839d6ef",
      "source_type": "AUTOMATION_HEALTH"
    },
    {
      "path": "research/health/autonomous-bridge.json",
      "repository": "techitechi0331-svg/cipi",
      "sha256": "536268b61e85c6c79d01f7dd68b948e26646030e3a55e8f0fec02e5548deb982",
      "source_type": "AUTONOMOUS_BRIDGE_HEALTH"
    },
    {
      "kind": "directory_index",
      "path": "research/jobs/completed",
      "repository": "techitechi0331-svg/cipi",
      "sha256": "31c120fca8fb89d7ff9c6d726eddfa3ea8d80b74a0654b006b0929bbfda252f5",
      "source_type": "CIPI_DIRECTORY_INDEX"
    },
    {
      "kind": "directory_index",
      "path": "research/jobs/queued",
      "repository": "techitechi0331-svg/cipi",
      "sha256": "b54b309c433057f67870fe95920acfaeb0724511b6d1cbb92a97a57acaf7c14a",
      "source_type": "CIPI_DIRECTORY_INDEX"
    },
    {
      "path": "research/jobs/queued/VIRTUAL-GUITAR-MIC-INTEGRATION-001.yaml",
      "repository": "techitechi0331-svg/cipi",
      "sha256": "8c1ec216ae9dd387221f4b0dc1547e2195cff9cdaf63647bcac0a16fab7437f5",
      "source_type": "RESEARCH_JOB"
    },
    {
      "kind": "directory_index",
      "path": "research/reviews",
      "repository": "techitechi0331-svg/cipi",
      "sha256": "a4cb70e1e33b585be56dee49611975b0fa373d5c9199d8f005396c38c4be648e",
      "source_type": "CIPI_DIRECTORY_INDEX"
    }
  ],
  "source_state_digest": "c2eed266c9d352283612fac7b237b091e6d36b5b1fb5bc1b5b86dc53081c12e0",
  "unresolved_questions": [
    "After the Cabinet/Speaker output boundary and the independent Mic Simulator contract, validation, and CIPI Integration Candidate have converged, can Virtual Guitar integrate the external Mic Engine through a versioned optional boundary without coupling to its internals or regressing existing guitar behavior?"
  ],
  "work": {
    "blocked_count": 1,
    "human_gate_count": 1,
    "queued_job_count": 1,
    "ready_count": 0
  }
}
