{
  "authority": "CONTEXT_RECONSTRUCTION_ONLY",
  "blocked": [],
  "cipi_ref": {
    "branch": "main",
    "commit_sha": "a8669722fcf320e91a07b3ad213eb436096f8c6f",
    "freshness_basis": "source_state_digest"
  },
  "conflicts": [],
  "freshness": "FRESH",
  "generated_at": "2026-09-29T09:21:49+09:00",
  "generation_id": "153d1adf73cc54b7216946bc",
  "human_gates": [],
  "latest_decision_refs": [],
  "phase": "IDLE",
  "product_ref": {
    "commit_sha": "f34851b7477bee36b9d314865407f92830e507b9",
    "ref": "main",
    "repository": "techitechi0331-svg/melon",
    "verification": "VERIFIED"
  },
  "project_id": "melon",
  "ready": [],
  "rejected_refs": [],
  "research": {
    "decision_ref_count": 0,
    "review_ref_count": 0,
    "track_lifecycle": {
      "MELON-BRIDGE-CLEAN-PROOF-002": {
        "reason": "BUDGET_EXHAUSTED",
        "scheduler_eligible": false,
        "state": "BUDGET_EXHAUSTED"
      },
      "MELON-BRIDGE-PILOT-001": {
        "reason": "BUDGET_EXHAUSTED",
        "scheduler_eligible": false,
        "state": "BUDGET_EXHAUSTED"
      }
    }
  },
  "resume_contract": {
    "blocked_dependencies": [],
    "can_autonomously_resume": false,
    "can_resume": true,
    "human_gates": [],
    "must_not_repeat": [],
    "recommended_action": "NO_READY_WORK",
    "required_context": [],
    "resume_mode": "IDLE"
  },
  "review_refs": [],
  "schema_version": "1.0",
  "source_manifest": [
    {
      "path": "automation/cross_repo/registry.yaml",
      "repository": "techitechi0331-svg/cipi",
      "sha256": "16dcf5716c87275af30d35893ca50597ae6598ed29bef533dafc3e9f1a4cb6c4",
      "source_type": "CROSS_REPO_REGISTRY"
    },
    {
      "kind": "directory_index",
      "path": "research/decisions",
      "repository": "techitechi0331-svg/cipi",
      "sha256": "c66ca453e5be3cbe4942fd2ffb73c9398d2c518acc95f32f83810a842e444a6d",
      "source_type": "CIPI_DIRECTORY_INDEX"
    },
    {
      "path": "research/health/automation-status.json",
      "repository": "techitechi0331-svg/cipi",
      "sha256": "eafb9ecb8fe3cf2b4d1a1557c408debbb88c652cfa2e01952cf562692ddbacd3",
      "source_type": "AUTOMATION_HEALTH"
    },
    {
      "path": "research/health/autonomous-bridge.json",
      "repository": "techitechi0331-svg/cipi",
      "sha256": "ff708d5b50435ec4099b172045bc2cd0998c1f5f4231ff6e640d713a7fd925c2",
      "source_type": "AUTONOMOUS_BRIDGE_HEALTH"
    },
    {
      "kind": "directory_index",
      "path": "research/jobs/completed",
      "repository": "techitechi0331-svg/cipi",
      "sha256": "ee970ab35df5491d37cd99a62c5e4ba72ffb4d5221fb35c9b5bc24d9ce0b098d",
      "source_type": "CIPI_DIRECTORY_INDEX"
    },
    {
      "kind": "directory_index",
      "path": "research/jobs/queued",
      "repository": "techitechi0331-svg/cipi",
      "sha256": "b54b309c433057f67870fe95920acfaeb0724511b6d1cbb92a97a57acaf7c14a",
      "source_type": "CIPI_DIRECTORY_INDEX"
    },
    {
      "kind": "directory_index",
      "path": "research/reviews",
      "repository": "techitechi0331-svg/cipi",
      "sha256": "4457638e9e833af714c8dedaf1a3abb8d5044d2c790371a62fc3ba3cc51bd1ea",
      "source_type": "CIPI_DIRECTORY_INDEX"
    }
  ],
  "source_state_digest": "58dba46fcc1486f1b548b6272e56600c8a5f29d7aedca1f6a2b3fb5c3a8537b3",
  "unresolved_questions": [],
  "work": {
    "blocked_count": 0,
    "human_gate_count": 0,
    "queued_job_count": 0,
    "ready_count": 0
  }
}
