{
  "authority": "CONTEXT_RECONSTRUCTION_ONLY",
  "blocked": [],
  "cipi_ref": {
    "branch": "main",
    "commit_sha": "27f4d85f9dd4404ec642f689e260931b357201ff",
    "freshness_basis": "source_state_digest"
  },
  "conflicts": [],
  "freshness": "FRESH",
  "generated_at": "2026-09-29T10:49:12+09:00",
  "generation_id": "dd71c551109593237752d7ff",
  "human_gates": [],
  "latest_decision_refs": [],
  "phase": "IDLE",
  "product_ref": {
    "commit_sha": "8d489802b785e98ab9bccb9d900b533b51cbf04c",
    "ref": "main",
    "repository": "techitechi0331-svg/Vocal_Denoise",
    "verification": "VERIFIED"
  },
  "project_id": "vocal_denoise",
  "ready": [],
  "rejected_refs": [],
  "research": {
    "decision_ref_count": 0,
    "review_ref_count": 0,
    "track_lifecycle": {
      "VOCAL-DENOISE-ARCH-001": {
        "reason": "DUPLICATE_ONLY",
        "scheduler_eligible": false,
        "scientific_convergence_claim": false,
        "state": "CONVERGED",
        "state_basis": "SCHEDULER_TERMINAL_ALIAS"
      },
      "VOCAL-DENOISE-BASELINE-001": {
        "reason": "DUPLICATE_ONLY",
        "scheduler_eligible": false,
        "scientific_convergence_claim": false,
        "state": "CONVERGED",
        "state_basis": "SCHEDULER_TERMINAL_ALIAS"
      },
      "VOCAL-DENOISE-DATASET-001": {
        "reason": "DUPLICATE_ONLY",
        "scheduler_eligible": false,
        "scientific_convergence_claim": false,
        "state": "CONVERGED",
        "state_basis": "SCHEDULER_TERMINAL_ALIAS"
      },
      "VOCAL-DENOISE-LOSS-001": {
        "reason": "DUPLICATE_ONLY",
        "scheduler_eligible": false,
        "scientific_convergence_claim": false,
        "state": "CONVERGED",
        "state_basis": "SCHEDULER_TERMINAL_ALIAS"
      },
      "VOCAL-DENOISE-PRESERVATION-001": {
        "reason": "DUPLICATE_ONLY",
        "scheduler_eligible": false,
        "scientific_convergence_claim": false,
        "state": "CONVERGED",
        "state_basis": "SCHEDULER_TERMINAL_ALIAS"
      },
      "VOCAL-DENOISE-ROBUSTNESS-001": {
        "reason": "DUPLICATE_ONLY",
        "scheduler_eligible": false,
        "scientific_convergence_claim": false,
        "state": "CONVERGED",
        "state_basis": "SCHEDULER_TERMINAL_ALIAS"
      },
      "VOCAL-DENOISE-RUNTIME-001": {
        "reason": "TRACK_DISABLED",
        "scheduler_eligible": false,
        "state": "DISABLED"
      },
      "VOCAL-DENOISE-VST3-001": {
        "reason": "TRACK_DISABLED",
        "scheduler_eligible": false,
        "state": "DISABLED"
      }
    }
  },
  "resume_contract": {
    "blocked_dependencies": [],
    "can_autonomously_resume": false,
    "can_resume": true,
    "human_gates": [],
    "must_not_repeat": [],
    "recommended_action": "NO_READY_WORK",
    "required_context": [],
    "resume_mode": "IDLE"
  },
  "review_refs": [],
  "schema_version": "1.0",
  "source_manifest": [
    {
      "path": "automation/cross_repo/registry.yaml",
      "repository": "techitechi0331-svg/cipi",
      "sha256": "16dcf5716c87275af30d35893ca50597ae6598ed29bef533dafc3e9f1a4cb6c4",
      "source_type": "CROSS_REPO_REGISTRY"
    },
    {
      "kind": "directory_index",
      "path": "research/decisions",
      "repository": "techitechi0331-svg/cipi",
      "sha256": "c66ca453e5be3cbe4942fd2ffb73c9398d2c518acc95f32f83810a842e444a6d",
      "source_type": "CIPI_DIRECTORY_INDEX"
    },
    {
      "path": "research/health/automation-status.json",
      "repository": "techitechi0331-svg/cipi",
      "sha256": "c2e3275721126f4d0f3d488818cb9e9a703eb52a9312804de4f3423747850e8e",
      "source_type": "AUTOMATION_HEALTH"
    },
    {
      "path": "research/health/autonomous-bridge.json",
      "repository": "techitechi0331-svg/cipi",
      "sha256": "4e6eb09f216d626f4fa4bb51afd9440b56b6b8c37abacdaff142d8eebc094514",
      "source_type": "AUTONOMOUS_BRIDGE_HEALTH"
    },
    {
      "kind": "directory_index",
      "path": "research/jobs/completed",
      "repository": "techitechi0331-svg/cipi",
      "sha256": "ee970ab35df5491d37cd99a62c5e4ba72ffb4d5221fb35c9b5bc24d9ce0b098d",
      "source_type": "CIPI_DIRECTORY_INDEX"
    },
    {
      "kind": "directory_index",
      "path": "research/jobs/queued",
      "repository": "techitechi0331-svg/cipi",
      "sha256": "b54b309c433057f67870fe95920acfaeb0724511b6d1cbb92a97a57acaf7c14a",
      "source_type": "CIPI_DIRECTORY_INDEX"
    },
    {
      "kind": "directory_index",
      "path": "research/reviews",
      "repository": "techitechi0331-svg/cipi",
      "sha256": "4457638e9e833af714c8dedaf1a3abb8d5044d2c790371a62fc3ba3cc51bd1ea",
      "source_type": "CIPI_DIRECTORY_INDEX"
    }
  ],
  "source_state_digest": "5eec4f2a329d77a6e616f17dc2bb3b81f8736137b726ecc09e81aad7bb9ca817",
  "unresolved_questions": [],
  "work": {
    "blocked_count": 0,
    "human_gate_count": 0,
    "queued_job_count": 0,
    "ready_count": 0
  }
}
